headline,date,doc_type,material_type,news_desk,section,keywords,url,id,byline
Why Won’t They Get Hearing Aids?,2012-04-05,article,News,,Health,"['Ears and Hearing', 'Elder Care']",https://newoldage.blogs.nytimes.com/2012/04/05/why-wont-they-get-hearing-aids/,nyt://article/6f7e834a-b499-5ddc-a066-36c5306371c9,By Susan Seliger
PROCEEDINGS OF CONGRESS.; SENATE.,1864-03-16,article,Archives,None,Archives,[],https://www.nytimes.com/1864/03/16/archives/proceedings-of-congress-senate.html,nyt://article/702856c4-a4a2-579b-b258-481188414e78,
A Real Mental aid Becomes A Movie ‘Cuckoo's Nest’,1975-04-13,article,Archives,None,Archives,"['Mental Health and Disorders', 'MOTION PICTURES', 'REVIEWS AND OTHER DATA ON SPECIFIC PRODUCTIONS']",https://www.nytimes.com/1975/04/13/archives/a-real-mental-ward-becomes-a-movie-cuckoos-nest-a-real-mental-ward.html,nyt://article/703ef204-27ce-568b-82c8-05fa3c89bd9b,By Richard Levine
NEWS OF THE DAY.,1860-06-30,article,Archives,None,Archives,[],https://www.nytimes.com/1860/06/30/archives/news-of-the-day.html,nyt://article/704afdfb-9789-54b9-ab43-9858c7f0bbcf,
DEAF AND DUMB GRADUATES.,1881-06-23,article,Archives,None,Archives,[],https://www.nytimes.com/1881/06/23/archives/deaf-and-dumb-graduates.html,nyt://article/707d9759-56df-5a36-91d3-0c82ae295a85,
MISCELLANEOUS NEWS.,1865-04-02,article,Archives,None,Archives,"['Newspapers', 'MISCELLANEOUS']",https://www.nytimes.com/1865/04/02/archives/miscellaneous-news.html,nyt://article/715016db-edda-5cc5-953f-734e6db21db3,
The Deaf and Dumb Asylum Anniversary.,1862-05-09,article,Archives,None,Archives,[],https://www.nytimes.com/1862/05/09/archives/the-deaf-and-dumb-asylum-anniversary.html,nyt://article/717fe0a5-dd3d-5801-a18a-388ba908c8cf,
Bargaining With My Father,2010-06-17,article,Op-Ed,Editorial,Opinion,"[""Father''s Day"", 'Families and Family Life', 'Deafness']",https://www.nytimes.com/2010/06/18/opinion/18iht-edbrody.html,nyt://article/71ea3ebd-1438-5aa2-8cf1-7c1ff4a7b9ec,By Bob Brody
China Exerts Influence Nurtured Over Decades,2011-12-20,article,News,Foreign,World,['International Relations'],https://www.nytimes.com/2011/12/21/world/asia/china-exerts-influence-nurtured-over-decades.html,nyt://article/7214131a-aab9-53b6-8599-178faf6e6eb2,By Edward Wong
Poor House Burnt.,1860-04-27,article,Archives,None,Archives,[],https://www.nytimes.com/1860/04/27/archives/poor-house-burnt.html,nyt://article/72ee05ae-20f7-5041-8446-c9d803e165a0,
DEAF AND DUMB SPECTATORS.,1886-04-09,article,Archives,None,Archives,[],https://www.nytimes.com/1886/04/09/archives/deaf-and-dumb-spectators.html,nyt://article/73e4841d-0004-5778-88e5-a6dc5ab3ed24,
Lectures before the Deaf and Dumb.,1854-11-23,article,Archives,None,Archives,[],https://www.nytimes.com/1854/11/23/archives/lectures-before-the-deaf-and-dumb.html,nyt://article/74132d36-9250-5677-a656-fd4ecc19744b,
"DEAF-MUTE BURGLARS CAUGHT.; Man They Were Robbing Also Deaf and Dumb, but Not His Young Son.",1899-09-18,article,Archives,None,Archives,[],https://www.nytimes.com/1899/09/18/archives/deafmute-burglars-caught-man-they-were-robbing-also-deaf-and-dumb.html,nyt://article/74433cc8-3a0f-5630-8bcb-953403263ece,Special to The New York Times
Books of The Times,1971-06-12,article,Archives,None,Archives,['BOOK REVIEWS'],https://www.nytimes.com/1971/06/12/archives/rich-language-poor-people.html,nyt://article/746c3016-8e79-5f1f-876b-499fed4626a7,
Southern Comforts,1978-04-23,article,Archives,None,Archives,[],https://www.nytimes.com/1978/04/23/archives/southern-comforts-airships.html,nyt://article/748b3416-4429-548c-9d2a-27ee3013b3c0,By Barry Hannah. 209 pp. New York: Alfred A. Knopf. $8.95
DEAF AND DUMB CONGRESS; Begun at Ghent -- All Proceedings Conducted in Sign Language.,1913-08-19,article,Archives,None,Archives,[],https://www.nytimes.com/1913/08/19/archives/deaf-and-dumb-congress-begun-at-ghent-all-proceedings-conducted-in.html,nyt://article/74aef066-f0bd-58e2-976b-1ef56a36aaee,
"Article 3 -- No Title; MOVEMENTS IN NEW-YORK. MOVEMENTS IN PENNSYLVANIA. MOVEMENTS IN MASSACHUSETTS. THE MASSACHUSETTS DEAD. EXECUTIVE DEPARTMENT, COUNCIL CHAMBER, MOVEMENTS IN CONNECTICUT. MOVEMENTS IN NEW-JERSEY. MOVEMENTS IN VERMONT. THE UNION SPIRIT IN MISSOURI. THE SIXTY-NINTH REGIMENT AT ANNAPOLIS.THEY SHOOT A PERSON CAUGHT TAMPERING WITHTHE BAILS AND ARRESTED A SPY. LOCAL MILITARY MOVEMENTS. CALL OF COL. ASEOTH UPON THE HUNGARIANS IN AMERICA. MILITARY MATTERS IN BROOKLYN. NOTICE HOME GUARD. DEPARTURE OF THE TWENTY EIGHTH REGIMENT.",1861-05-03,article,Archives,None,Archives,[],https://www.nytimes.com/1861/05/03/archives/article-3-no-title-movements-in-newyork-movements-in-pennsylvania.html,nyt://article/7530a8cb-f545-5a68-b0d6-48b0a3694e3d,
Pinball's Back And Wizards Tilt With Joy,1991-02-06,article,News,Living Desk,Home & Garden,['Pinball Machines'],https://www.nytimes.com/1991/02/06/garden/pinball-s-back-and-wizards-tilt-with-joy.html,nyt://article/7583db21-f381-57c1-bdf5-01b58be01224,By James Barron
Books of The Times,1977-09-26,article,Archives,None,Archives,['BOOK REVIEWS'],https://www.nytimes.com/1977/09/26/archives/long-island-opinion-books-of-the-times-black-lamb-great-dame.html,nyt://article/760ec311-ae70-5d30-a789-50ab24886b32,By John Leonard
American Institute Fair.,1865-10-11,article,Archives,None,Archives,[],https://www.nytimes.com/1865/10/11/archives/american-institute-fair.html,nyt://article/7664b8ec-c9eb-5921-b547-c392ddf7971a,
THE SCREEN; A Chip of the Old Block.,1925-06-16,article,Review,AMUSEMENTS HOTELS AND RESTAURANTS,Archives,['MOTION PICTURES'],https://www.nytimes.com/1925/06/16/archives/the-screen-a-chip-of-the-old-block.html,nyt://article/7689606e-7b07-5828-a2e4-e97aa664a2b7,By Mordaunt Hall
Arts and Leisure Guide,1975-11-16,article,Archives,None,Archives,"['Music', 'CONCERTS AND RECITALS']",https://www.nytimes.com/1975/11/16/archives/article-1-no-title-arts-and-leisure-guide-arts-and-leisure-guide.html,nyt://article/76a3a858-28d3-5450-97c1-ef916376dde4,
Loss Is the Measure of Love,1993-02-14,article,Review,Book Review Desk,Books,['BOOK REVIEWS'],https://www.nytimes.com/1993/02/14/books/loss-is-the-measure-of-love.html,nyt://article/78217f1f-7989-5e89-af7b-e8f48b760f72,By Jim Shepard
"ECHOES TILDEN'S CALL HERE; He Scores Roosevelt as 'Blind, Deaf and Dumb' to Tammany Graft. FEARS 'RULE BY RACKET' 'Punish the Scoundrels,' Is the Candidate's Final Plea at Historic Cooper Union. SEES THE CITY SACRIFICED Governor Was Afraid a Full Inquiry Would Hurt Chances in 1932, Rival Charges.",1930-11-02,article,Archives,None,Archives,"['Politics and Government', 'Elections', 'GOVERNOR', 'Elections', 'ATTORNEY GENERAL']",https://www.nytimes.com/1930/11/02/archives/echoes-tildens-call-here-he-scores-roosevelt-as-blind-deaf-and-dumb.html,nyt://article/78dbaece-30db-5ea9-af9e-891fa277f9ea,
BARON ROGER DE SEILLIERE DEAD.; A DEAF-AND-DUMB NOBLEMAN WHO HAD TRAVELED MUCH.,1892-08-27,article,Archives,None,Archives,[],https://www.nytimes.com/1892/08/27/archives/baron-roger-de-seilliere-dead-a-deafanddumb-nobleman-who-had.html,nyt://article/79e31b17-2676-5e94-a987-568618d1cc22,
RELIGIOUS.; Notices of Religious Movements.,1860-03-31,article,Archives,None,Archives,[],https://www.nytimes.com/1860/03/31/archives/religious-notices-of-religious-movements.html,nyt://article/7a47c548-34f7-5449-a6b5-89d7468db60a,
President of a Financially Troubled Theater in Westchester Resigns,1977-11-13,article,Archives,None,Archives,[],https://www.nytimes.com/1977/11/13/archives/president-of-a-financially-troubled-theater-in-westchester-resigns.html,nyt://article/7b10b763-2619-54e4-baa2-17b12c2e5479,By Edward Hudson Special to The New York Times
"DEPARTMENT OF THE INTERIOR.; Report of Hon. J.B. Thompson, Secretary of the Interior.",1860-12-06,article,Archives,None,Archives,[],https://www.nytimes.com/1860/12/06/archives/department-of-the-interior-report-of-hon-jb-thompson-secretary-of.html,nyt://article/7c15eeca-2da8-5fd8-99de-ed49ea566887,
Deaf-and-Dumb Boys Strike.; An Editor Loses His Wheel.,1896-10-28,article,Archives,None,Archives,[],https://www.nytimes.com/1896/10/28/archives/deafanddumb-boys-strike-an-editor-loses-his-wheel.html,nyt://article/7c20e739-a271-5db0-b004-b4d25fccee3f,
"BANQUET TO THE DEAF AND DUMB.; A banquet to 200 deaf and dumb men and women took place at St. Mand , near Paris, yesterday. Several speeches were made, which were eagerly followed, if not listened to, and very much applauded.",1888-08-06,article,Archives,None,Archives,[],https://www.nytimes.com/1888/08/06/archives/banquet-to-the-deaf-and-dumb-a-banquet-to-200-deaf-and-dumb-men-and.html,nyt://article/7c3f0b22-1c94-5e0b-b5b0-26977d687dbe,
"In the 90's, 'Tommy' Plays a Fancier Pinball",1993-07-18,article,Review,Arts & Leisure Desk,Theater,"['RECORDINGS (AUDIO)', 'Reviews', 'Theater']",https://www.nytimes.com/1993/07/18/theater/recordings-view-in-the-90-s-tommy-plays-a-fancier-pinball.html,nyt://article/7debed1e-23af-5ede-8e5c-5b9f9ab07965,By Ken Tucker
COMMISSIONERS OF EMIGRATION.; WEEKLY STATEMENT.,1860-01-12,article,Archives,None,Archives,[],https://www.nytimes.com/1860/01/12/archives/commissioners-of-emigration-weekly-statement.html,nyt://article/7ee447e3-803a-5811-b5b4-077f0007241a,
THE SCREEN; Beauty and Wild Beasts. Shrewd Bootleggers. Love and Sulking. Other Photoplays.,1928-02-27,article,Review,,Archives,['MOTION PICTURES'],https://www.nytimes.com/1928/02/27/archives/the-screen-beauty-and-wild-beasts-shrewd-bootleggers-love-and.html,nyt://article/7f9988ab-a594-5735-9afb-a113cb591ad2,By Mordaunt Hall
Easter Island: The Dream at the End of the World,2006-04-30,article,News,Travel,Travel,['Travel and Vacations'],https://www.nytimes.com/2006/04/30/travel/30easter.html,nyt://article/7fda20c5-9bbb-574b-b493-9559348d53d2,By EDWARD ALBEE
  Playwrights Who Put Words At Center Stage,1990-02-11,article,News,Arts and Leisure Desk,Theater,"['Language and Languages', 'Theater']",https://www.nytimes.com/1990/02/11/theater/stage-view-playwrights-who-put-words-at-center-stage.html,nyt://article/800b5f6d-0c9c-5d42-889e-dd0383a41c3c,By Mel Gussow
The Connecticut Campaign.; GOV. WISE REGRETS THAT HE CANNOT TAKE THE STUMP FOR EX-GOV. SEYMOUR.,1860-03-16,article,Archives,None,Archives,[],https://www.nytimes.com/1860/03/16/archives/the-connecticut-campaign-gov-wise-regrets-that-he-cannot-take-the.html,nyt://article/808a746a-d87d-5c28-8ba4-950bbe9a6a80,
THE CAPTURE OF JACKSON.; Particulars of the Brief Siege--Our Forces at Work Destroying the Railroads--Gen. Lauman's Blunder.,1863-08-01,article,Archives,None,Archives,['WAR'],https://www.nytimes.com/1863/08/01/archives/the-capture-of-jackson-particulars-of-the-brief-siegeour-forces-at.html,nyt://article/80b1d63c-4e5f-5247-897b-d57ae83b0fc0,
A visit to Peking University—What the Cultural Revolution Was All About,1971-10-24,article,Archives,None,Archives,['Colleges and Universities'],https://www.nytimes.com/1971/10/24/archives/a-visit-to-peking-university-what-the-cultural-revolution-was-all-a.html,nyt://article/80c40fac-743a-588a-9ea2-7b7bff6770db,By B. Michael Frolic
"DEAF AND DUMB HOME BURNED.(2); Gullaudet Institution, Near Pough- keepsie, Destroyed.",1900-02-19,article,Archives,None,Archives,[],https://www.nytimes.com/1900/02/19/archives/deaf-and-dumb-home-burned2-gullaudet-institution-near-pough-keepsie.html,nyt://article/80f35a05-7add-54e0-a214-9b9cd9ce1390,
"DEAF AND DUMB HOME BURNED.; Gullaudet Institution, Near Pough- keepsie, Destroyed.",1900-02-19,article,Archives,None,Archives,[],https://www.nytimes.com/1900/02/19/archives/deaf-and-dumb-home-burned-gullaudet-institution-near-pough-keepsie.html,nyt://article/81558490-3c0b-5d87-829a-2f9c90935ff9,
How ‘Survivor’ Failed Its #MeToo Test,2019-12-12,article,News,Culture,Arts,"['Television', '#MeToo Movement', 'Sexual Harassment']",https://www.nytimes.com/2019/12/12/arts/television/survivor-dan-spilo.html,nyt://article/8194cdbb-b95b-5d67-b168-882afc37e35e,By James Poniewozik
THE DEAD AND DUMB.; Convention of American Instructors of Deaf and Dumb.,1856-08-19,article,Archives,None,Archives,[],https://www.nytimes.com/1856/08/19/archives/the-dead-and-dumb-convention-of-american-instructors-of-deaf-and.html,nyt://article/8246791d-f69f-50a7-bdd8-fa1c10bded16,
Navigating Life With Humor and Bewilderment,2008-01-08,article,News,Culture,Arts,"['Families and Family Life', 'MOTION PICTURES', 'Autism', 'Medicine and Health', ""Asperger's Syndrome""]",https://www.nytimes.com/2008/01/08/arts/television/08gott.html,nyt://article/8263c364-9e76-52c1-8841-054492f1189c,By Felicia R. Lee
DIED.,1864-09-27,article,Archives,None,Archives,[],https://www.nytimes.com/1864/09/27/archives/died.html,nyt://article/82b3053a-0454-58d8-ae9c-fd89b1a2a2b7,
A Disc That Offers a Spin Through the Youth Subculture of a City,2005-12-04,article,News,Travel Desk,Travel,['Travel and Vacations'],https://www.nytimes.com/2005/12/04/travel/a-disc-that-offers-a-spin-through-the-youth-subculture-of-a-city.html,nyt://article/8306afde-dae7-5c28-bd74-a88a6f4034f3,By Austin Considine
CHILDREN OF DEAF SHARE THEIR LIVES,1986-12-15,article,News,Style Desk,Style,"['Deafness', 'Children and Youth']",https://www.nytimes.com/1986/12/15/style/the-family-children-of-deaf-share-their-lives.html,nyt://article/831ebe24-299a-574e-a103-6e108022a915,By Glenn Collins
What’s in a Name? (Part 1),2012-04-30,article,News,,Opinion,"['Imposters', 'Names, Personal']",https://opinionator.blogs.nytimes.com/2012/04/29/whats-in-a-name-part-1/,nyt://article/835685f2-cc95-5841-804e-e2d3ab7b7a8d,By Errol Morris
Deaf and Dumb Pickpockets,1958-03-09,article,Archives,None,Archives,[],https://www.nytimes.com/1958/03/09/archives/deaf-and-dumb-pickpockets.html,nyt://article/84a9d2d5-59d8-58fb-879f-f3674a5fefed,
"FROM ALBANY.; Final Passage of the Maine Law. PASSAGE OF THE CANAL BILLS. The Police Bill--Deaf and Dumb Asylum-- Commissioner of Records, &c., &c. RECAPITULATION.",1854-03-25,article,Archives,None,Archives,[],https://www.nytimes.com/1854/03/25/archives/from-albany-final-passage-of-the-maine-law-passage-of-the-canal.html,nyt://article/84bce3ae-afee-5b6c-ae2b-3f7c931b3376,[By Telegraph.] Special Dispatch To the New-York Daily Times
Critic's Notebook; Damping 60's Fire of 'Tommy' for 90's Broadway,1993-04-27,article,Review,Cultural Desk,Theater,['Theater'],https://www.nytimes.com/1993/04/27/theater/critic-s-notebook-damping-60-s-fire-of-tommy-for-90-s-broadway.html,nyt://article/85ae00ec-5b17-53f5-b69f-f85f7a685a31,By Jon Pareles
A Storm Over New Uses for Oral School at Mystic,1979-10-21,article,Archives,None,Archives,[],https://www.nytimes.com/1979/10/21/archives/connecticut-weekly-a-storm-over-new-uses-for-oral-school-at-mystic.html,nyt://article/85bbfa73-f8d4-52af-96cb-2f277f5bbdd4,By Steven Slosberg
BOARD OF SUPERVISORS.; Estimates of country Expenses for 1863--Another Veto on Harlem Bridge--The Former Veto Overruled--The New Court-house--Prospect of Several More Vetoes--Aids to the City Judge.,1862-12-17,article,Archives,None,Archives,[],https://www.nytimes.com/1862/12/17/archives/board-of-supervisors-estimates-of-country-expenses-for-1863another.html,nyt://article/8666e2e5-04e3-52bc-9574-7745bfda6055,
Sherman's Campaign Already a Success.,1864-12-03,article,Archives,None,Archives,['Editorials'],https://www.nytimes.com/1864/12/03/archives/shermans-campaign-already-a-success.html,nyt://article/86c5cdae-cc26-54f9-b084-ad957fd298c8,
Anger and faith : An open letter to my Palestinian friends,2003-10-04,article,,IHT News,Opinion,[],https://www.nytimes.com/2003/10/04/opinion/IHT-anger-and-faith-an-open-letter-to-my-palestinian-friends.html,nyt://article/87bd86ff-40a0-5a60-a638-7556c5a612bd,"By Avraham Burg, International Herald Tribune"
"For Baltimore, Housing Slump Slows a Revival",2007-10-04,article,News,Business,Business Day,"['Area Planning and Renewal', 'Economic Conditions and Trends', 'Housing']",https://www.nytimes.com/2007/10/04/business/04baltimore.html,nyt://article/87f3b299-2d2f-5c1d-83ee-b1587e270f72,By Louis Uchitelle
Easter Island: The dream at the end of the world,2006-05-01,article,News,IHT News,Travel,[],https://www.nytimes.com/2006/05/01/travel/01iht-web.0501albee.html,nyt://article/8874559a-57c7-51c0-a21e-668c2f446e70,By Edward Albee
NEW-YORK CITY.; A Visit to the Dispensaries. City Mortality. Leaning Pole. Another Foundling. City Superintendent of Schools' Report. Deaf and Dumb. CORPOREAL PUNISHMENT. Cleaning Streets. COURT CALENDAR--MONDAY. The African Slave Trade. UNITED STATES MARSHAL'S OFFICE. SUPREME COURT--SPECIAL TERM--MAY 26. SUPERIOR COURT--GENERAL TERM--May 26 The Chemical Bank Forgery--Trial of Lyman Cole. COURT OF GENERAL SESSIONS--MAY 26.,1855-05-28,article,Archives,None,Archives,[],https://www.nytimes.com/1855/05/28/archives/newyork-city-a-visit-to-the-dispensaries-city-mortality-leaning.html,nyt://article/889476fe-95da-5b4f-b3de-e6f67e12c28a,
EXCHANGE OF PRISONERS.,1861-12-01,article,Archives,None,Archives,[],https://www.nytimes.com/1861/12/01/archives/exchange-of-prisoners.html,nyt://article/88e39c51-57fb-59d0-b9d9-a6f388505f11,
"STAMPS;
SPORTS AND HUMANITIES DOMINATE '83 ISSUES",1982-12-05,article,News,Arts and Leisure Desk,Arts,['Stamps (Postal)'],https://www.nytimes.com/1982/12/05/arts/stamps-sports-and-humanities-dominate-83-issues.html,nyt://article/89bf0537-b0b3-52c5-9f59-422f5b00d6a7,By Samuel A. Tower
COLUMBIA NEGOTIATORS FAIL TO GAIN ACCORD ON PROTEST,1985-04-20,article,News,Metropolitan Desk,New York,"['Foreign Investments', 'Demonstrations and Riots']",https://www.nytimes.com/1985/04/20/nyregion/columbia-negotiators-fail-to-gain-accord-on-protest.html,nyt://article/8a91b4a5-f3b7-5b33-b898-9234de7f0dfe,
STATE LEGISLATURE.,1864-01-22,article,Archives,None,Archives,[],https://www.nytimes.com/1864/01/22/archives/state-legislature.html,nyt://article/8cb6d8f4-7ac7-56a3-ba45-ced5895960f9,
To Wed in Deaf and Dumb Language,1927-08-28,article,Archives,None,Archives,[],https://www.nytimes.com/1927/08/28/archives/to-wed-in-deaf-and-dumb-language.html,nyt://article/8d1b8665-2d85-5f1a-ab1b-7216429c1f02,
THE DEAF AND DUMB.; AN INTERESTING EXHIBITION BY THE PUPILS OF THE NEW-YORK INSTITUTION.,1880-05-19,article,Archives,None,Archives,[],https://www.nytimes.com/1880/05/19/archives/the-deaf-and-dumb-an-interesting-exhibition-by-the-pupils-of-the.html,nyt://article/8d4f4b41-846c-544c-85e4-e943f5cd0964,
‘Tommy’ Is Poignantly Sentimental,1970-06-08,article,Archives,None,Archives,[],https://www.nytimes.com/1970/06/08/archives/tommy-is-poignantly-sentimental.html,nyt://article/8eb71423-3640-5907-a72b-af2ee1778537,By Donal Henahan
THE BIRTH AND SLOW ACCEPTANCE OF 'JOE EGG',1985-03-24,article,Interview,Arts and Leisure Desk,Theater,['Theater'],https://www.nytimes.com/1985/03/24/theater/the-birth-and-slow-acceptance-of-joe-egg.html,nyt://article/8f122868-2c52-53d7-8129-b72ff31001a9,By Benedict Nightingale London
CHILDREN'S BOOKS,1985-11-03,article,Review,Book Review Desk,Books,"['BOOK REVIEWS', 'Children and Youth']",https://www.nytimes.com/1985/11/03/books/children-s-books-129476.html,nyt://article/8f27e38a-8da9-5348-a095-59fae7521965,By Karla Kuskin
"Sri Lanka, Navy SEALs, Egypt: Your Wednesday Briefing",2019-04-24,article,briefing,NYTNow,Briefing,[],https://www.nytimes.com/2019/04/23/briefing/sri-lanka-navy-seals-egypt.html,nyt://article/8f584c23-55f2-5cef-9ed4-ac46e783d356,By Melina Delkic
Look Away,2002-12-08,article,News,The City Weekly Desk,New York,[],https://www.nytimes.com/2002/12/08/nyregion/new-york-observed-look-away.html,nyt://article/8f92e8bc-59a1-563d-9583-8abeefed813b,By Siri Hustvedt
"LAURA BRIDGMAN.; THB BLIND, DEAF, AND DUMB WOMAN'S VISIT TO A WATCH FACTORY.",1887-05-23,article,Archives,None,Archives,[],https://www.nytimes.com/1887/05/23/archives/laura-bridgman-thb-blind-deaf-and-dumb-womans-visit-to-a-watch.html,nyt://article/8ff89b7b-e8a6-519e-801b-09bae8261e10,
'60 MINUTES' LOOKS AT ITSELF AND ITS PRACTICES,1981-09-29,article,News,Cultural Desk,Arts,"['TELEVISION PROGRAMS', 'Television', 'News and News Media']",https://www.nytimes.com/1981/09/29/arts/60-minutes-looks-at-itself-and-its-practices.html,nyt://article/9001de00-fb8b-53cd-8a88-5c0c7b982084,By Tony Schwartz
Deaf and Dumb Hold Celebration.,1917-04-16,article,Archives,None,Archives,[],https://www.nytimes.com/1917/04/16/archives/deaf-and-dumb-hold-celebration.html,nyt://article/917e2880-4772-5010-866b-3d6f577688de,
'I Shall Come Out All Right From This Hell',1994-07-03,article,Review,Book Review Desk,Books,['BOOK REVIEWS'],https://www.nytimes.com/1994/07/03/books/i-shall-come-out-all-right-from-this-hell.html,nyt://article/918aca0f-06ae-5199-bbf4-342c377d4aed,By Gillian Beer
The Brawley Battlefield,1990-07-29,article,Review,Book Review Desk,Books,['BOOK REVIEWS'],https://www.nytimes.com/1990/07/29/books/the-brawley-battlefield.html,nyt://article/91cdbe5a-8f64-5a43-9565-a5401d331116,By Ellen Goodman
THE DEAF AND DUMB.; Closing Exercises of the New-York Institution--Interesting Performances of the Pupils--Names of the Graduates.,1870-06-23,article,Archives,None,Archives,[],https://www.nytimes.com/1870/06/23/archives/the-deaf-and-dumb-closing-exercises-of-the-newyork.html,nyt://article/924c869a-d7ff-57b3-84a1-8734d8137758,
ONCE A DEAF AND DUMB GIRL.; MORE MISDEEDS BROUGHT UP AGAINST MARTHA VAN KIESIER.,1885-02-27,article,Archives,None,Archives,[],https://www.nytimes.com/1885/02/27/archives/once-a-deaf-and-dumb-girl-more-misdeeds-brought-up-against-martha.html,nyt://article/9260a53f-ca33-585f-9349-68cd7bac6f30,
THE GOVERNOR'S MESSAGE.; THE STATE GOVERNMENT.,1865-01-04,article,Archives,None,Archives,['WAR'],https://www.nytimes.com/1865/01/04/archives/the-governors-message-the-state-government.html,nyt://article/92c5f100-bac5-55f9-90b8-37be3455ac0f,
"Keeping Bankers’ Hours, European Observers Miss Most of Ukraine War",2016-07-27,article,News,Foreign,World,['International Relations'],https://www.nytimes.com/2016/07/28/world/europe/ukraine-war-osce-observers.html,nyt://article/92dcaf97-965d-5829-a51b-33adb1581e10,By Andrew E. Kramer
LOCAL POLITICS.; 7788,1860-10-30,article,Archives,None,Archives,[],https://www.nytimes.com/1860/10/30/archives/local-politics-7788.html,nyt://article/92fd199d-0642-5f8f-b3a7-fc693d3dbe10,
NEIGHBORHOOD REPORT: NEW YORK ON LINE ; Travels With Sheila: A Down and Under View of New York,1997-09-28,article,News,The City Weekly Desk,New York,"['COMPUTERS AND INFORMATION SYSTEMS', 'INTERNET AND WORLD WIDE WEB']",https://www.nytimes.com/1997/09/28/nyregion/neighborhood-report-new-york-line-travels-with-sheila-down-under-view-new-york.html,nyt://article/931c73b4-4d42-5ee0-80da-9a3a5f19b424,By Anthony Ramirez
NEWS OF THE DAY.,1860-10-13,article,Archives,None,Archives,[],https://www.nytimes.com/1860/10/13/archives/news-of-the-day.html,nyt://article/9364d57f-6b2e-54cf-8e43-1a73443549c3,
Amusements.,1860-08-31,article,Archives,None,Archives,[],https://www.nytimes.com/1860/08/31/archives/amusements.html,nyt://article/93f0640f-993f-547f-855f-b7eb6143aa28,
NEW-YORK CITY.; UNITED STATES CIRCUIT AND DISTRICT COURTS ANNIVERSARY OF THE MARINE SOCIETY. A PICTURE IN CANDY EXHUMING THE DEAD FROM THE YARD OF THE BRICK CHURCH. WASH AND BE CLEAN. TH GRANITE STATE. ATTORNEY'S LIEN FOR COSTS. THE CHURCH OF THE DEAF AND DUMB. THE QUEEN OF ENGLAND AND THE EXHIBITION. ARRIVAL OF STRAWBERRIES. DEPARTURE OF THACKERAY AN IMPOSTER BOARD OF ASSISTANTS. STATED MEETING OF THE BOARD OF EDUCATION. ACCIDENTS. COURT CALENDAR,1853-04-22,article,Archives,None,Archives,[],https://www.nytimes.com/1853/04/22/archives/newyork-city-united-states-circuit-and-district-courts-anniversary.html,nyt://article/941e84ef-d918-59c7-9835-50c48447b191,
Who’s Next? Roger Daltrey,2018-11-30,article,Review,BookReview,Books,['Books and Literature'],https://www.nytimes.com/2018/11/30/books/review/thanks-a-lot-mr-kibblewhite-roger-daltrey.html,nyt://article/94356548-2144-5d3b-8bba-bb8fa8875a74,By James Parker
INSTRUCTORS OF THE DEAF AND DUMB.,1879-05-21,article,Archives,None,Archives,[],https://www.nytimes.com/1879/05/21/archives/instructors-of-the-deaf-and-dumb.html,nyt://article/9445f67d-5882-55fb-b27d-007e5428c45d,
"HELEN KELLER CAN SING NOW; Born Blind, Deaf, and Dumb, She Has Overcome All Handicaps.",1912-08-16,article,Archives,None,Archives,[],https://www.nytimes.com/1912/08/16/archives/helen-keller-can-sing-now-born-blind-deaf-and-dumb-she-has-overcome.html,nyt://article/94509d90-1692-5a6b-bb2d-526ef02bb747,Special to The New York Times
Film,1974-06-23,article,Archives,None,Archives,[],https://www.nytimes.com/1974/06/23/archives/what-the-blazes-is-ken-russell-up-to-now-a-rock-opera-what-the.html,nyt://article/9493fd6b-323c-57ba-95a9-a2636f664849,By William Hall
THE WAR IN THE UNITED STATES.; Letters from the Southern States of America.,1861-07-30,article,Archives,None,Archives,[],https://www.nytimes.com/1861/07/30/archives/the-war-in-the-united-states-letters-from-the-southern-states-of.html,nyt://article/94adfb9b-fb91-5747-9998-14fb8252856a,
Deaf and Dumb Boy Quizzed All Night Long by Sleuths,1925-02-07,article,Archives,None,Archives,['ROBBERIES AND ASSAULTS'],https://www.nytimes.com/1925/02/07/archives/deaf-and-dumb-boy-quizzed-all-night-long-by-sleuths.html,nyt://article/94bf5288-0973-5b77-a821-474bee56a378,
About New York,1975-04-04,article,Archives,None,Archives,['Gambling'],https://www.nytimes.com/1975/04/04/archives/about-new-york-its-still-the-devils-game.html,nyt://article/94fb9201-0afd-5cf5-b49b-1091ab62e52d,By Tom Buckley
Massachusetts Coach Is Sorry Marquette Switched to N.I.T.,1970-03-10,article,Archives,None,Archives,[],https://www.nytimes.com/1970/03/10/archives/massachusetts-coach-is-sorry-marquette-switched-to-nit.html,nyt://article/9508316c-61cb-5a22-98f1-b352709cf48b,
THE SCREEN,1919-08-19,article,Review,,Archives,['MOTION PICTURES'],https://www.nytimes.com/1919/08/19/archives/the-screen.html,nyt://article/95612395-6ddd-545d-b435-614258d9b31c,
