headline,date,doc_type,material_type,news_desk,section,keywords,url,id,byline
Easter Island: The Dream at the End of the World,2006-04-30,article,News,Travel Desk,Travel,['Travel and Vacations'],https://www.nytimes.com/2006/04/30/travel/easter-island-the-dream-at-the-end-of-the-world.html,nyt://article/af5d427b-899b-5e76-9dc5-f9a473d944d8,By Edward Albee
Treasure Chest; The Deaf and Dumb,1945-09-23,article,Archives,None,Archives,[],https://www.nytimes.com/1945/09/23/archives/treasure-chest-the-deaf-and-dumb.html,nyt://article/af9fda65-7682-5089-8ed2-df0f0bc45565,
Jewish Graves Desecrated in Historic French Cemetery,2019-12-04,article,News,Foreign,World,"['Jews and Judaism', 'Cemeteries', 'ANTI-SEMITISM']",https://www.nytimes.com/2019/12/04/world/europe/jewish-graves-france-desecrated.html,nyt://article/b00e5881-aae1-5b15-add0-932482b03356,By Adam Nossiter
FROM ALBANY.; THE MEDICAL BILL. Report of the Deaf and Dumb Asylum. NEW-YORK COURT OF COMMON PLEAS. Indebtedness of one of our Prisons. THE TEMPERANCE BILL.,1854-03-03,article,Archives,None,Archives,[],https://www.nytimes.com/1854/03/03/archives/from-albany-the-medical-bill-report-of-the-deaf-and-dumb-asylum.html,nyt://article/b03fc0fb-3989-559f-bd60-1a7e6fa2dfe9,SPECIAL CORRESPONDENCE OF THIS N. Y. DAILY TIMES
THE INTERIOR DEPARTMENT,1863-12-10,article,Archives,None,Archives,['Editorials'],https://www.nytimes.com/1863/12/10/archives/the-interior-department.html,nyt://article/b097895a-9709-5941-b340-f6a22a5dcd91,
NEWS OF THE DAY.; THE REBELLION. GENERAL NEWS. The Democracy and the War. Rumored Rebel Advance upon Wheeling. The Army in Motion. Reception of the Returning Regiments.,1863-04-29,article,Archives,None,Archives,"['NATIONAL', 'Editorials']",https://www.nytimes.com/1863/04/29/archives/news-of-the-day-the-rebellion-general-news-the-democracy-and-the.html,nyt://article/b09a2f73-b700-5a02-bc23-ee2837cce7d9,
FROM TEXAS.; Gov. Hamilton Calls a Convention-- Qualifications of Voters--Social Condition of the People--Sympathy for Jeff. Davis.,1865-09-09,article,Archives,None,Archives,['FOREIGN'],https://www.nytimes.com/1865/09/09/archives/from-texas-gov-hamilton-calls-a-convention-qualifications-of.html,nyt://article/b0b200ac-243a-5eac-b560-696e66cac21c,
DEPARTMENT OF THE INTERIOR.; Report of Secretary Smith.,1861-12-06,article,Archives,None,Archives,[],https://www.nytimes.com/1861/12/06/archives/department-of-the-interior-report-of-secretary-smith.html,nyt://article/b10b857f-699a-51d5-8f43-bedf4fd3488c,
Where Women Made History,1976-06-06,article,Archives,None,Archives,['Historic Buildings and Sites'],https://www.nytimes.com/1976/06/06/archives/where-women-made-history-where-10-american-women-made-history.html,nyt://article/b1cc1578-322f-56ef-89ec-0a546be9d410,By Jurate Kazickas and LYNN SHERR
Deaf and Dumb Students Aroused.,1898-04-25,article,Archives,None,Archives,[],https://www.nytimes.com/1898/04/25/archives/deaf-and-dumb-students-aroused.html,nyt://article/b29cff9b-2a07-59c6-a6d4-3543ca581736,
About New York,1977-10-15,article,Archives,None,Archives,"['Finances', 'EXPENSE BUDGET']",https://www.nytimes.com/1977/10/15/archives/about-new-york-wall-street-views-of-reality.html,nyt://article/b2ccbb89-6a4a-5739-a017-5fa67636b420,By Francis X. Clines
"THE DEAF AND DUMB.; Convention of American Instructors of the Deaf and Dumb, at Columbus, O. Interesting Proceedings.",1853-08-15,article,Archives,None,Archives,[],https://www.nytimes.com/1853/08/15/archives/the-deaf-and-dumb-convention-of-american-instructors-of-the-deaf.html,nyt://article/b37ae67a-fd87-59c8-925b-d04b8944306a,SPECIAL CORRESPONDENCE OF THE N. Y. DAILY TIMES
"A BRIDEGROOM'S RECEPTION.; THE PRETENDS TO BE DEAF AND DUMB, AND PROVES TO BE MARRIED AND IN THE POSSESSION OF ALL HIS FACULTIES.",1876-05-14,article,Archives,None,Archives,[],https://www.nytimes.com/1876/05/14/archives/a-bridegrooms-reception-the-pretends-to-be-deaf-and-dumb-and-proves.html,nyt://article/b3a11756-fd9c-5e0a-9b00-bdead6bd51e0,
"LOCAL INTELLIGENCE.; EPISCOPAL BOARD OP MISSIONS. Annual Meeting at the Church of the Ascension--Reports of the Home, Foreign and other Committees. Second Day's Proceedings. The New-York and New-Jersey Synod. Plymouth Church Festival--Second Day. Old School Presbyterian synod. THE CITY CHAMBERLAIN. Letter from Mr. Peter B. Sweeny. American Institute Fair--Visit of the Deaf and Dumb. Board of Charities and Correction. Board of Internal Revenue. Board of Councilmen.",1867-10-18,article,Archives,None,Archives,['MISCELLANEOUS'],https://www.nytimes.com/1867/10/18/archives/local-intelligence-episcopal-board-op-missions-annual-meeting-at.html,nyt://article/b3fb98e7-f0b9-511c-beb3-ea1ce52a9055,
The Deaf and Dumb.,1853-08-20,article,Archives,None,Archives,[],https://www.nytimes.com/1853/08/20/archives/the-deaf-and-dumb.html,nyt://article/b44fc96a-b557-57cb-970a-e1975824e5fb,
PHASES OF FOREIGN LIFE.; AN ACTRESS AND THE DUDES--A FAMOUS DEAF AND DUMB PEDDLER.,1884-05-11,article,Archives,None,Archives,[],https://www.nytimes.com/1884/05/11/archives/phases-of-foreign-life-an-actress-and-the-dudesa-famous-deaf-and.html,nyt://article/b47c44d2-ffa2-5ca0-bd6a-6329fb96e5fd,
"THE PRINCE IN THE METROPOLIS.; Grand Ball at the Academy of Music. Full Description of the Academy and its Decorations. BREAK-DOWN OF THE PLATFORM A Very Great Jam and very Little Dancing. The Prince's Parlor and Reception Rooms. Scenes Outside and at the Fifth Avenue Hotel.THE MORNING MOVEMENTS OF THE PRINCE. He Visits the University, Woman's Library, Astor Library, the Cooper Institute, the Free Academy, and the Deaf and Dumb Institution. ADDRESSES AND EXERCISES.A Drive Through the Central Park--A Lunch with Mayor Wood, and a Sail on the Harriet Lane. THE DECORATIONS OF THE ACADEMY. SCENES OUTSIDE THE ACADEMY. SCENES AT THE FIFTH-AVENUE HOTEL. THE PRINCE'S MOVEMENTS YESTERDAY. THE PRINCE IN THE METROPOLIS.",1860-10-13,article,Archives,None,Archives,[],https://www.nytimes.com/1860/10/13/archives/the-prince-in-the-metropolis-grand-ball-at-the-academy-of-music.html,nyt://article/b498fa36-2582-5432-b683-cedef3802676,
DR. GRENFELL'S WORK.; What He Is Doing for the Hardy Fishermen of Inhospitable Labrador. Aid for Deaf and Dumb.,1922-10-13,article,Archives,None,Archives,[],https://www.nytimes.com/1922/10/13/archives/dr-grenfells-work-what-he-is-doing-for-the-hardy-fishermen-of.html,nyt://article/b4b32e63-0590-5acb-bf29-9e205409a653,THEODORE AINSWORTH GREENE.JOSEPH C. GAW
"Joy Reid, MSNBC Host, Apologizes Again as More Incendiary Blog Posts Surface",2018-06-01,article,News,Business,Business Day,"['Blogs and Blogging (Internet)', 'Cyberattacks and Hackers', 'Homosexuality and Bisexuality', 'Discrimination', 'Apologies']",https://www.nytimes.com/2018/06/01/business/media/joy-reid-msnbc-apology.html,nyt://article/b5295c4e-efa5-53c5-9c13-c90af36bf98b,By Daniel Victor
DEAF AND DUMB ASYLUM.,1867-03-23,article,Archives,None,Archives,['MISCELLANEOUS'],https://www.nytimes.com/1867/03/23/archives/deaf-and-dumb-asylum.html,nyt://article/b57e5539-078b-5afc-9793-e4ba6317841c,
COMPTROLLER'S STATEMENT.; BALANCES OF COUNTY APPROPRIATIONS.,1861-02-07,article,Archives,None,Archives,[],https://www.nytimes.com/1861/02/07/archives/comptrollers-statement-balances-of-county-appropriations.html,nyt://article/b5b534b3-6087-5bc5-833c-27631fba82e6,
Will an All‐Star Cast Help ‘Tommy’?,1972-12-17,article,Archives,None,Archives,[],https://www.nytimes.com/1972/12/17/archives/will-an-allstar-cast-help-tommy-will-an-allstar-can-help-the-whos.html,nyt://article/b5be71fe-7bf9-540a-87b4-463d10b20b45,By John Rockwell
The Criminal Gets the Breaks,1964-11-29,article,Archives,None,Archives,['Crime and Criminals'],https://www.nytimes.com/1964/11/29/archives/the-criminal-gets-the-breaks.html,nyt://article/b626d567-7e93-5f98-baac-20e632751ea8,
Baltimore's revival stalled by housing downturn,2007-10-04,article,News,IHT News,Business Day,[],https://www.nytimes.com/2007/10/04/business/worldbusiness/04iht-baltimore.1.7748241.html,nyt://article/b632dd50-5b59-5362-9237-cf24b556ba16,By Louis Uchitelle
"MORE BAD MINING.; Fall of the Oxford Mine at Hyde Park, Pennsylvania. Great Fissures in the Principal Avenues and Streets.Several Buildings Cracked and Rendered Untenable Careless Mining the Cause An Undesirable Place of Residence. Recent Changes in Constantinople. Shocking Outrages in South Carolina. A Man Leaves His Property to a Deaf and Dumb Asylum to Avoid Being Talked About.",1871-11-17,article,Archives,None,Archives,[],https://www.nytimes.com/1871/11/17/archives/more-bad-mining-fall-of-the-oxford-mine-at-hyde-park-pennsylvania.html,nyt://article/b68cd4f6-e687-5ae9-9d4d-dda6385ee1a8,
Once-dominant India misses Olympics,2008-03-10,article,News,IHT News,Sports,[],https://www.nytimes.com/2008/03/10/sports/10iht-HOCKEY.1.10866749.html,nyt://article/b7253cff-b404-5fff-b04f-5e682d0793ac,
"THE FREE STATE OF TENNESSEE.; Detailed Account of Its Resources, Climates, Productions, Manufactures, Railroad System, &c., &c.",1865-02-16,article,Archives,None,Archives,['MISCELLANEOUS'],https://www.nytimes.com/1865/02/16/archives/the-free-state-of-tennessee-detailed-account-of-its-resources.html,nyt://article/b8035a59-2a4f-5bda-8728-b3a6c62cea59,From Our Own Correspondent
"FESTIVAL OF THE DEAF AND DUMB.; Interesting Ceremonies at Washington Heights. NEW INSTITUTION FOR DEAF-MUTES. LAYING OF THE CORNER-STONE. Addresses by Dr. H. P. Peet, Mayor Westervelt, Rev. Dr. Adams, &c. Letters from Gov Seymour, Senator Seward, Secretary Randall, and others.",1853-11-23,article,Archives,None,Archives,[],https://www.nytimes.com/1853/11/23/archives/festival-of-the-deaf-and-dumb-interesting-ceremonies-at-washington.html,nyt://article/b8d98a61-d1b1-5b86-aa2c-4e463848b334,
DISTRIBUTION OF THE ACADEMY FUND,1860-01-23,article,Archives,None,Archives,[],https://www.nytimes.com/1860/01/23/archives/distribution-of-the-academy-fund.html,nyt://article/b8de4446-5b40-5fed-bfc4-f06d5f87b6b5,
DIED.,1862-12-19,article,Archives,None,Archives,[],https://www.nytimes.com/1862/12/19/archives/died.html,nyt://article/b8e405ac-8c89-55c0-8f00-3a18842266c7,
FOREIGN ITEMS.,1865-09-24,article,Archives,None,Archives,['FOREIGN'],https://www.nytimes.com/1865/09/24/archives/foreign-items.html,nyt://article/b92ee5b2-8f06-57a1-af39-66ad948a8da9,
THE ANNIVERSARIES.; Continuatlon of the Religious and Charitable Celebrations.THE ABOLITIONISTS IN HIGH COUNCIL. SPEECH OF MR. WENDELL PHILLIPS. The Five Points Demonstration at the Academy of Music.PROGRAMME FOR THE REMAINDER OF THEWEEK.,1860-05-09,article,Archives,None,Archives,[],https://www.nytimes.com/1860/05/09/archives/the-anniversaries-continuatlon-of-the-religious-and-charitable.html,nyt://article/b9aeba19-15ae-55b8-b107-f96cf50498d1,
THE POSITION OF VIRGINIA.; REV. DR. OSGOOD'S DISCOURSE AT THE CHURCH OF THE MESSIAH. HENRY WARD BEECHER'S DISCOURSE. SERVICES AT DR. CHAPIN'S CHURCH. THE CHURCH ANTI-SLAVERY SOCIETY ANNIVERSARY. PRESENTATION OF A BIBLE TO MAJOR ANDERSON'S SON.,1861-05-06,article,Archives,None,Archives,[],https://www.nytimes.com/1861/05/06/archives/the-position-of-virginia-rev-dr-osgoods-discourse-at-the-church-of.html,nyt://article/b9cfff3b-9777-5a4f-8ccd-74635baa764d,
A DEAF AND DUMB LAWYER.,1889-02-15,article,Archives,None,Archives,[],https://www.nytimes.com/1889/02/15/archives/a-deaf-and-dumb-lawyer.html,nyt://article/b9eaf488-7003-52e2-afd8-d0feeefc2567,
An Actress Who Reads the Soul of Fugard,1988-04-10,article,News,Arts and Leisure Desk,Theater,['Theater'],https://www.nytimes.com/1988/04/10/theater/an-actress-who-reads-the-soul-of-fugard.html,nyt://article/ba3d5bcf-3ea1-5c42-bd08-6e44ceb49550,By Laurie Winer
4 Killed and 50 Hurt in Riots Over Indian Magazine Article,1986-12-08,article,News,Foreign Desk,World,"['Islam', 'Demonstrations and Riots', 'News and News Media']",https://www.nytimes.com/1986/12/08/world/4-killed-and-50-hurt-in-riots-over-indian-magazine-article.html,nyt://article/ba5072e3-a8c8-5b91-a365-35be05e07bf7,Reuters
New-York Deaf and Dumb Institution.,1863-05-16,article,Archives,None,Archives,['MISCELLANEOUS'],https://www.nytimes.com/1863/05/16/archives/newyork-deaf-and-dumb-institution.html,nyt://article/ba57acdb-a16e-5a7d-9bb8-b71cd61037b5,
NEW-YORK STATE FINANCES.; ANNUAL STATEMENT FOR 1865. Abstract of Comptroller Robinson's Report Interesting Review of the Debtsand Means of the State. CONDITION OF THE TREASURY. NEW-YORK CITY BEHIND TIME. THE STATE DEBT. CONDITION OF THE SEVERAL FUNDS.,1865-12-31,article,Archives,None,Archives,['Editorials'],https://www.nytimes.com/1865/12/31/archives/newyork-state-finances-annual-statement-for-1865-abstract-of.html,nyt://article/ba7e0013-c511-571b-9185-968808a54b65,
The May Anniversaries.,1865-05-08,article,Archives,None,Archives,[],https://www.nytimes.com/1865/05/08/archives/the-may-anniversaries.html,nyt://article/baa9045a-4c18-545d-b478-a8a72c98d7ef,
Books of The Times; Two Accounts of What It Means to Be Disabled,1989-09-30,article,Review,Cultural Desk,Books,['BOOK REVIEWS'],https://www.nytimes.com/1989/09/30/books/books-of-the-times-two-accounts-of-what-it-means-to-be-disabled.html,nyt://article/bbb53226-a050-5e78-9d69-231fdeb867a1,By Herbert Mitgang
The Case of Major Beckwith Reply of Our Washington Correspondent.; UNFOUNDED ASPERSIONS.,1861-10-18,article,Archives,None,Archives,[],https://www.nytimes.com/1861/10/18/archives/the-case-of-major-beckwith-reply-of-our-washington-correspondent.html,nyt://article/bbc78e4f-4688-5c73-97b2-fd72ec338cb8,
She's 94 and Still Busy Doing for Others,1970-12-04,article,Archives,None,Archives,"['Longevity', 'SOUTH']",https://www.nytimes.com/1970/12/04/archives/shes-94-and-still-busy-doing-for-others.html,nyt://article/bbeb1a7f-4542-5ac3-b408-2e034a27bfeb,By Angela Taylor
"NEW-YORK CITY.; AMUSEMENTS THIS EVENING. Testimonial to Capt. E. M. Fitch, of the Steamship Washington. Dr. Sims on a Hospital for Females. MAY A RAILROAD PASSENGER BREAK DOORS? THE HARLEM RAILROAD. INSTITUTION FOR THE DEAF AND DUMB. ILLNESS OF BISHOP WAINWRIGHT. COURT CALENDAR-FRIDAY",1854-05-19,article,Archives,None,Archives,[],https://www.nytimes.com/1854/05/19/archives/newyork-city-amusements-this-evening-testimonial-to-capt-e-m-fitch.html,nyt://article/bc553509-aef4-554f-8dcd-0d79af380c95,
Hunting the Japanese Lion.,1860-06-21,article,Archives,None,Archives,[],https://www.nytimes.com/1860/06/21/archives/hunting-the-japanese-lion.html,nyt://article/bc5d98ed-5fed-562b-92b0-a0b5be9364f2,
‘NBC Theater’,1979-06-23,article,Archives,None,Archives,"['TELEVISION AND RADIO', 'PROGRAMS', 'MOTION PICTURES', 'TELEVISION AND RADIO', 'PROGRAMS']",https://www.nytimes.com/1979/06/23/archives/nbc-theater-planning-3-major-play-productions-the-big-event-and.html,nyt://article/bd511650-6716-584c-a430-0400a72b0b67,By Les Brown
"WELCOME TO THE PRINCE.; EXTRAORDINARY DEMONSTRATION. Two hundred Thousand People Aid in the Ovation. His Reception on Board the Harriet Lane and at Castle Garden. THE REVIEW ON THE BATTERY. The Procession and scenes Along Broadway. PASSING MILITARY SALUTE AT THE CITY HALL. What the People Said and Did, and How they Liked It. No Accidents No Disturbances. The Programme for To-Day, ON BOARD THE HARRIET LANE. AT CASTLE GARDEN. THE REVIEW OF THE BATTERY. THE PROCESSION. AT THE FIFTH-AVENUE HOTEL. WHAT THE PEOPLE DID. WELCOME TO THE PRINCE. THE EVENING AT THE HOTEL. NO ACCIDENTS. THE PROGRAMME FOR TO-DAY. THE PRINCE'S BALL.",1860-10-12,article,Archives,None,Archives,[],https://www.nytimes.com/1860/10/12/archives/welcome-to-the-prince-extraordinary-demonstration-two-hundred.html,nyt://article/be47f64a-72a3-591e-a741-d0d7fc2f5326,
SPEECH RESTORED BY SHOCK.; Mary Fisher Had Been Deaf and Dumb Eight Years.,1894-09-10,article,Archives,None,Archives,['Lightning'],https://www.nytimes.com/1894/09/10/archives/speech-restored-by-shock-mary-fisher-had-been-deaf-and-dumb-eight.html,nyt://article/be7bdb40-9def-5385-9220-c0508de0313f,
THE BATTLE OF WINCHESTER.,1862-04-20,article,Archives,None,Archives,[],https://www.nytimes.com/1862/04/20/archives/the-battle-of-winchester.html,nyt://article/be7f7524-3eea-5028-a61b-a24837815d61,
THE SCREEN,1927-07-05,article,Review,amusements hotels and restaurants,Archives,['MOTION PICTURES'],https://www.nytimes.com/1927/07/05/archives/the-screen.html,nyt://article/be99810e-6cc5-5993-97fc-3c0b6dd60071,By Mordaunt Hall
American Geographical and Statistical Society.; INTERESTING PARTICULARS OF THE COMING CENSUS. Solider's Library. Internal Revenue. The Quota and the Draft.,1865-02-03,article,Archives,None,Archives,['MISCELLANEOUS'],https://www.nytimes.com/1865/02/03/archives/american-geographical-and-statistical-society-interesting.html,nyt://article/bef429b9-bc1c-5771-b402-1eec2312bb7b,
Knights' Executive Relishes a Challenge,1991-04-04,article,News,Sports Desk,Sports,['Football'],https://www.nytimes.com/1991/04/04/sports/pro-football-knights-executive-relishes-a-challenge.html,nyt://article/bff4bd19-2740-536d-a949-462686634fd1,By Thomas George
THE INTEREST TO BE PAID ON MISSOURI STATE BONDS.,1861-05-26,article,Archives,None,Archives,[],https://www.nytimes.com/1861/05/26/archives/the-interest-to-be-paid-on-missouri-state-bonds.html,nyt://article/c02e2d3c-b589-53c9-8a17-6e89c5ad2a10,
"DEPARTMENT OF THE INTERIOR.; REPORT OF SECRETARY UPSHUR. PUBLIC LAND SYSTEM. THE PACIFIC RAILROAD. HOMESTEAD LAW. TAXING THE GOLD MINES. THE INDIANS. PENSIONS. PATENT OFFICE. NATIONAL INSANE HOSPITAL. COLUMBIA DEAF AND DUMB INSTITUTION. CAPITOL EXTENSION. PUBLIC BUILDINGS. WASHINGTON AQUEDUCT. ALEXANDRIA AND WASHINGTON RAILROAD. POLICE COMMISSIONERS. INTERNAL AFFAIRS OF THE DISTRICT. DETECTIVE POLICE. AFRICAN SLAVE-TRADE. THE RECAPTURED AFRICANS. INDISPOSITION OF NEGROES TO COLONIZE. BUREAU OF NATIONAL STATISTICS. BOOKS AND DOCUMENTS. UNITED STATES COURTS IN THIS CITY. THE UNION PACIFIC RAILROAD COMPANY, GOLD FIELDS IN ARIZONA.",1863-12-10,article,Archives,None,Archives,[],https://www.nytimes.com/1863/12/10/archives/department-of-the-interior-report-of-secretary-upshur-public-land.html,nyt://article/c0b06488-1cab-5e06-836a-3d41382f6608,
MISCELLANEOUS.,1860-03-29,article,Archives,None,Archives,[],https://www.nytimes.com/1860/03/29/archives/miscellaneous.html,nyt://article/c12b6499-0493-53af-9c92-5ebf269e26a7,
Harper's Bazaar is moving to increase ad pages with a new Web site and television campaign.,1998-03-05,article,News,Business/Financial Desk,Business Day,"['COMPUTERS AND INFORMATION SYSTEMS', 'ADVERTISING', 'Television', 'INTERNET AND WORLD WIDE WEB']",https://www.nytimes.com/1998/03/05/business/media-business-advertising-harper-s-bazaar-moving-increase-ad-pages-with-new-web.html,nyt://article/c13a9410-a43e-582c-9135-7b8ed04e5d51,By Jane L. Levere
The Home for Young Deaf Mutes--Correction.,1860-03-03,article,Archives,None,Archives,[],https://www.nytimes.com/1860/03/03/archives/the-home-for-young-deaf-mutescorrection.html,nyt://article/c14982f0-2ba4-5cd4-ac8c-7392cbbecb72,THOMAS GALLAUDET
ITALIAN BOXER WOUNDED; Deaf-Dumb Bantam Champion Seriously Hurt in Dispute,1955-02-13,article,Archives,None,Archives,"['SHOOTINGS', 'Boxing', 'WORLD CHAMPIONS']",https://www.nytimes.com/1955/02/13/archives/italian-boxer-wounded-deafdumb-bantam-champion-seriously-hurt-in.html,nyt://article/c1edd7af-e98d-52b7-ba88-23fa13db9b4b,
"THE JAPANESE IN NEW-YORK.; The Grand Ball Where are all the Tickets? Who Sells Them? What the Japanese are Doing. &c., &c.",1860-06-25,article,Archives,None,Archives,[],https://www.nytimes.com/1860/06/25/archives/the-japanese-in-newyork-the-grand-ball-where-are-all-the-tickets.html,nyt://article/c41dab4e-89fe-547a-ab9c-40ef90b28d5a,
GOVERNOR'S MESSAGE.; To the Senate and Assembly:,1861-01-03,article,Archives,None,Archives,[],https://www.nytimes.com/1861/01/03/archives/governors-message-to-the-senate-and-assembly.html,nyt://article/c48437ec-e16a-581d-90d3-de35957d0261,
To Stop Redlining,1976-06-14,article,Archives,None,Archives,['Housing'],https://www.nytimes.com/1976/06/14/archives/to-stop-redlining.html,nyt://article/c4867794-8aa7-5630-ae30-ae5b312224d0,
Abuse Victim Is Suspicious About Timing Of Apology,2002-04-11,article,News,Metropolitan Desk,New York,"['Sex Crimes', 'Child Abuse and Neglect', 'Priests', 'Suits and Litigation']",https://www.nytimes.com/2002/04/11/nyregion/abuse-victim-is-suspicious-about-timing-of-apology.html,nyt://article/c49cfbfa-bab4-5bf8-bcd9-34a1936f3078,By Andy Newman
FOREIGN ITEMS.,1864-03-06,article,Archives,None,Archives,['MISCELLANEOUS'],https://www.nytimes.com/1864/03/06/archives/foreign-items.html,nyt://article/c4e6da96-cafc-58f1-8cbc-15860194ea65,
Holocaust Films That Redeem Germans,2009-02-10,article,News,,Week in Review,[],https://ideas.blogs.nytimes.com/2009/02/10/holocaust-films-that-redeem-germans/,nyt://article/c5430c72-71d7-566b-b583-67c05b1b6269,By Tom Kuntz
BROOKLYN CITY.; MARRIAGE AT THE DEAF AND DUMB INSTITUTE. SUDDEN DEATH. COUP DE SOLEIL SHOCKING ACCIDENT. LAFAYETTE AVENUE ACCIDENT. PICKPOCKETS PIC-NIC. COURT MARTIAL SABBATH SCHOOL EXCURSION. FALSE PRETENCES. STEALING A HORSE AND WAGON.,1852-07-29,article,Archives,None,Archives,[],https://www.nytimes.com/1852/07/29/archives/brooklyn-city-marriage-at-the-deaf-and-dumb-institute-sudden-death.html,nyt://article/c5dcf182-7af4-51de-9481-e1be4f96a875,
THE EPISCOPAL CONVENTION.; Thanksgiving and Prayer in the Morning Bitter Debate and Angry Feelings in the Afternoon More Discussion on Slavery What Caused the War? MEETING OF THE CONVENTION. A SUDDEN STORM. A LULL BITTER DEBATE.,1865-10-22,article,Archives,None,Archives,[],https://www.nytimes.com/1865/10/22/archives/the-episcopal-convention-thanksgiving-and-prayer-in-the-morning.html,nyt://article/c6496109-d5cd-5637-b4b5-ec27f1d7017e,From Our Own Correspondent
Second Day of the Great Anniversaries.; REPORTS OF THE BENEVOLENT SOCIETIES. Interesting Exercises of the Young Men's Christian Association. The Programme of the Week. TIMES AND PLACES OF THE MAY ANNIVERSARY MEETINGS.,1860-05-08,article,Archives,None,Archives,[],https://www.nytimes.com/1860/05/08/archives/second-day-of-the-great-anniversaries-reports-of-the-benevolent.html,nyt://article/c66d6e28-5d9b-54c6-b248-e3dce9dfae7a,
"Two Heads Together, Playing as One",2008-09-19,article,Review,Arts&Leisure,Arts,['Jazz'],https://www.nytimes.com/2008/09/21/arts/music/21play.html,nyt://article/c6c91727-7896-5a24-b4c5-80784b025687,By Nate Chinen
"In Trenton, Insurance Rates Are Protested",1997-04-24,article,News,Metropolitan Desk,New York,"['Prices (Fares, Fees and Rates)', 'Demonstrations and Riots', 'Automobile Insurance and Liability']",https://www.nytimes.com/1997/04/24/nyregion/in-trenton-insurance-rates-are-protested.html,nyt://article/c6f8bcfb-3caa-5faa-ab3b-8920bc54d538,By Jennifer Preston
"WESTERN MARYLAND.; The Opening Spring--Cumberland, Its Inhabitants and the Scenery Round About It--A Secesh Family--Rebel Music and Poetry--Our Troops Gen. Kelly--New-Creek--An Encampment--Distinguished Officers--Bush Rangers--The sixth Virginia Regiment--The Cheat Mountain Country and its Magnificent Scenery--Artists and Sportsmen--Trout Fishing in the Mountains--Harper's Ferry Crossing--Col. Dixon. H. Miles--A Fac Simile of the Dora"" of Porte Crayon.",1862-05-12,article,Archives,None,Archives,[],https://www.nytimes.com/1862/05/12/archives/western-maryland-the-opening-springcumberland-its-inhabitants-and.html,nyt://article/c724739d-6567-5f03-9fcb-5e485f83175e,
ITALY.; Notes of a Trip from Munich to Florence State of Northern and Central Italy Political Prospects.,1860-02-21,article,Archives,None,Archives,['Travel and Vacations'],https://www.nytimes.com/1860/02/21/archives/italy-notes-of-a-trip-from-munich-to-florence-state-of-northern-and.html,nyt://article/c76abcab-e537-57ae-bd2a-1fcae35bc433,
Is $75 Million in Venture Capital an Advantage?,2013-06-19,article,News,,Business Day,"['Entrepreneurship', 'Small Business', 'Start-ups', 'Venture Capital']",https://boss.blogs.nytimes.com/2013/06/19/is-50-million-in-venture-capital-an-advantage/,nyt://article/c8197ef2-8187-5771-ac10-ebbbd65c8212,By Ian Mount
PROCEEDINGS OF THE LEGISLATURE.; SENATE. EVEFNING SESSION.,1863-04-24,article,Archives,None,Archives,[],https://www.nytimes.com/1863/04/24/archives/proceedings-of-the-legislature-senate-evefning-session.html,nyt://article/c8231fe9-d5c8-5a11-89a3-86f563f7f8ac,
A 2D BANK EXPLAINS POLICY ON CITY NOTES,1977-10-13,article,Archives,None,Archives,"['Finances', 'EXPENSE BUDGET']",https://www.nytimes.com/1977/10/13/archives/a-2d-bank-explains-policy-on-city-notes-chemical-chief-asserts.html,nyt://article/c82c255a-dcec-5a64-b815-e49894562b10,By Steven R. Weisman
Why Americans in Paris Get Lost on the Metro,1986-12-19,article,Letter,Editorial Desk,Opinion,['Language and Languages'],https://www.nytimes.com/1986/12/19/opinion/l-why-americans-in-paris-get-lost-on-the-metro-490786.html,nyt://article/c877f930-6b57-55cb-b554-ee4881c6ec18,
"DUKE OF NORFOLK MAY MARRY AGAIN; Reported to be Engaged to Lady Alice Fitzwilliam. Only Child of the Earl Marshal of England Was Born Deaf, Dumb, and Blind.",1901-10-19,article,Archives,None,Archives,[],https://www.nytimes.com/1901/10/19/archives/duke-of-norfolk-may-marry-again-reported-to-be-engaged-to-lady.html,nyt://article/c8da5834-1824-58c9-a5ed-4a2af8ef8dea,
THE DEAF AND DUMB IN ANTIQUITY.--,1884-11-02,article,Archives,None,Archives,[],https://www.nytimes.com/1884/11/02/archives/the-deaf-and-dumb-in-antiquity.html,nyt://article/c8e73cd3-a428-503e-a797-d9503ea65475,
‘The Wild Child’ Raises Curtain,1970-09-11,article,Archives,None,Archives,"['MOTION PICTURES', 'REVIEWS AND OTHER DATA ON SPECIFIC PRODUCTIONS', 'Children and Youth', 'BEHAVIOR AND TRAINING']",https://www.nytimes.com/1970/09/11/archives/the-wild-child-raises-curtain.html,nyt://article/c945c5a2-363f-598d-a50c-1d9dc9e8fcc8,By Vincent CanBY
